{
  "$id": "https://raw.githubusercontent.com/public-transport/transport-apis/v1/schema.json#",
  "$schema": "http://json-schema.org/draft-07/schema#",
  "description": "public transport API description",
  "type": "object",
  "required": [
    "name",
    "type",
    "supportedLanguages",
    "coverage",
    "options"
  ],
  "properties": {
    "name": {
      "type": "string"
    },
    "type": {
      "type": "object",
      "propertyNames": {
        "enum": [
          "efa",
          "hafasMgate",
          "hafasQuery",
          "navitia",
          "otpGraphQl",
          "otpRest"
        ]
      },
      "additionalProperties": {
        "type": "boolean"
      }
    },
    "supportedLanguages": {
      "type": "array",
      "items": {
        "type": "string",
        "pattern": "^[a-z][a-z]$",
        "description": "ISO-639-1 language code"
      }
    },
    "coverage": {
      "type": "object",
      "minProperties": 1,
      "additionalProperties": false,
      "properties": {
        "realtimeCoverage": {
          "$ref": "#/definitions/coverage"
        },
        "regularCoverage": {
          "$ref": "#/definitions/coverage"
        },
        "anyCoverage": {
          "$ref": "#/definitions/coverage"
        }
      }
    },
    "attribution": {
      "type": "object",
      "oneOf": [
        { "$ref": "#/definitions/attribution_opendata" },
        { "$ref": "#/definitions/attribution_proprietary" }
      ]
    },
    "options": {
      "type": "object"
    }
  },
  "definitions": {
    "coverage": {
      "type": "object",
      "minProperties": 1,
      "additionalProperties": false,
      "properties": {
        "area": {
          "$ref": "#/definitions/coverage_geojson"
        },
        "region": {
          "$ref": "#/definitions/coverage_region"
        }
      }
    },
    "coverage_geojson": {
      "type": "object",
      "required": [
        "type",
        "coordinates"
      ],
      "properties": {
        "type": {
          "type": "string",
          "enum": [
            "Polygon"
          ]
        },
        "coordinates": {
          "type": "array",
          "items": {
            "type": "array",
            "minItems": 4,
            "items": {
              "type": "array",
              "minItems": 2,
              "items": {
                "type": "number"
              }
            }
          }
        },
        "bbox": {
          "type": "array",
          "minItems": 4,
          "items": {
            "type": "number"
          }
        }
      }
    },
    "coverage_region": {
      "type": "array",
      "items": {
        "type": "string",
        "pattern": "^[a-zA-Z][a-zA-Z](-[a-zA-Z][a-zA-Z])?$",
        "description": "ISO-3166-1/2 country/region code"
      },
      "minItems": 1
    },
    "attribution_opendata": {
      "type": "object",
      "required": [
        "license",
        "name"
      ],
      "properties": {
        "license": {
          "type": "string",
          "description": "Open Definition license ID or SPDX license id"
        },
        "name": {
          "type": "string"
        },
        "homepage": {
          "type": "string"
        }
      }
    },
    "attribution_proprietary": {
      "type": "object",
      "required": [
        "isProprietary"
      ],
      "properties": {
        "isProprietary": {
          "type": "boolean"
        }
      }
    }
  }
}
